,static,sentence
2083,换档软轴,"档位不好画,该机档位不好挂，有点卡,该机档位不好挂，有点卡，经检查是变速操纵阀档位拉线位置调整不当，存在间隙偏差，造成挂档手柄不好挂档"
2084,风扇,"风扇损坏,发动机风扇断裂。,发动机风扇断裂"
2085,加力器,"前加力器不回油。,前刹时有时无,加力器损坏"
2086,加力器,"后轮刹车抱死。,后轮夹钳抱死,加力器损坏"
2087,风扇,"风扇叶损坏,损坏,损坏"
2088,下铰接螺栓,"下铰接销松脱，电子燃油泵不工作,下链接销松动,下铰接销紧固螺丝断裂，更换螺丝，故障排除"
2089,推拉软轴,"小臂不回位,动臂沉，转斗不回位,用刹车油清洗拉线货到更换"
2090,推拉软轴,"收斗不好用,客户反应收斗不好用,重新调整紧固后试车正常"
2091,加力器,"左前轮刹车温度高,加力器回油阀块卡死,加力器回油阀块卡死"
2092,O型圈,"漏油,该机漏油是因密封圈埙坏所致。,O形圈埙坏。,"
2093,左门锁,"门锁打不开,驾驶室门锁从外边打不开,卸开驾驶左室门锁紧固锁芯螺丝后试车正常"
2094,前传动轴及支承总成,"前传动轴损坏,整机前传动轴断裂变形！,更换后正常！"
2095,换档软轴,"档位操纵杆软轴损坏！,调整变速操纵阀软轴！,维修调整变速操纵软轴正常！"
2096,左门锁,"门锁不住,客户反应锁不上门,左门锁扣固定断裂，导致门锁不上。更换以后正常。"
2097,刹车管,"刹车油管漏油,刹车漏油,更换新的刹车油管后一切正常"
2098,前桥螺栓,"前桥螺栓断裂,前桥螺栓断裂,螺栓断裂。"
2099,风扇,"风扇叶断裂,风扇叶断裂,风扇叶断裂造成皮带断裂"
2100,加力器,"刹车不好,后加力器漏气,后加力器损坏"
2101,工作泵,"1，方向故障（空转），2，工作泵异响。,工作泵内泄  大臂无力,工作泵内泄、压力过低导致大臂无力"
2102,左门锁,"左门无法正常开关,客户反应门锁不能从驾驶室内打开,检查发现，左门内开手柄拉线脱落，把脱落拉线重新装好，故障排除"
2103,加力器,"刹车不好,加力器加油口冒油,加力器内部泄露"
2104,气管接头,"漏气,客户报修漏气,拆卸后发现组合垫损坏导致漏气，更换组合垫后试车正常。"
2105,雨刮总成,"雨刮臂不工作,雨刮臂不工作,紧固雨刮臂固定螺栓后试车正常"
2106,组合阀,"机子排气阀漏气,该机组合阀漏气,经检查组合阀内部损坏漏气，组合阀一直处于排气状态"
2107,油管接头,"方向盘震动大,该机震动大、是因先导阀接头空间隙大所致。,更换先导阀接头后试机正常。"
2108,O型圈,"漏油,该机在转斗油缸工作时会有油从转斗油缸进油管处漏出,经现场拆下该机漏油的油管发现O型圈已损坏，而O型圈的损坏导致密封不严所以液压油才从该管子接头处漏出！"
2109,螺栓,"后传动轴脱落,装载机后传动轴螺丝断裂脱落,后传动轴螺丝脱落以及断裂断裂，导致传动轴和后主传动器连接处法兰螺丝丝牙损坏"
2110,螺栓,"配重松动,客户反应机子做工时，配重晃动。,配重螺丝松松动。"
2111,组合阀,"漏气,漏气,经到现场检查发现组合阀损坏导致漏气，，经更换新组合阀后试车工作正常。"
2112,雨刮总成,"手刹不灵敏，液压油吸油软管渗油，雨刮器不动,用户反映雨刮器不动,用户反映雨刮器不动，检查发现螺丝松动，紧固后正常。"
2113,加力器,"前加力器不回油，无刹车。,用户反应改机前轮出现无刹车现象,经拆卸前加力气总成更换新加力气总成排除空气后试机，该机前轮杀车制动灵敏，故障排除"
2114,螺栓,"漏油,客户反应漏油,重新紧固后试车正常"
2115,加力器,"加力器损坏,没有刹车,损坏"
2116,气制动阀总成,"制动阀漏气,制动阀漏气,检查为制动阀内部密封不好，导致漏气，更换制动阀后故障排除"
2117,风扇,"维修发动机风扇损坏,发动机风扇损坏,发动机风扇损坏，导致有异响"
2118,喇叭,"喇叭不响,更换保险丝后，喇叭不响。,电喇叭失效"
2119,加力器,"漏油,用户反馈该机前轮刹车不灵，加力器缺少刹车油,维修更换前桥加力器后，故障排除。"
2120,推拉软轴,"大臂操纵杆回不到中位,该机大臂操纵杆回不到中位,拉线螺丝松动"
2121,工作灯,"驾驶证顶灯不亮,顶灯不亮,烧毁"
2122,螺栓,"门锁管不严,驾驶室左门锁晃动厉害,门锁质量问题"
2123,前桥螺栓,"前桥螺栓断,前桥螺栓断裂,前桥螺栓断裂"
2124,刹车管,"刹车油管断裂,自动夹钳管路断裂,断裂"
2125,螺栓,"流量放大阀外接油管固定螺丝断了|流量放大阀外接油管固定螺丝断了,流量放大阀外接油管固定螺丝断裂,螺丝断裂"
2126,气管接头,"脚制动阀漏气,脚制动阀漏气。,脚制动阀漏气"
2127,按钮阀,"按纽阀漏气,按钮阀排气空漏气。,按约上阀密封不严漏气。"
2128,螺栓,"变速箱冒油。,工作泵和变速泵接合处漏油,工作泵固定螺栓松动"
2129,空调继电器,"空调散热器持续运转，关不了。,空调散热器风扇不会停,继电器损坏"
2130,气管接头,"漏气，刹车不灵,气制动阀管头漏气，刹车不灵,损坏"
2131,喇叭,"喇叭不响,喇叭不响,损坏"
2132,螺栓,"漏油,前主传动漏油。,主传动安装螺丝松动。"
2133,螺栓,"异响,副车架销子螺丝掉了，销子退出来了。,副车架销子螺丝脱落，销子退出来了。"
2134,左门锁,"门锁钥匙丢了，换门锁,驾驶室门开不了,钥匙丢了"
2135,上罩,"后罩掉漆,损坏,损坏"
2136,螺栓,"座椅坏了锁不住,司机坐椅不稳往后昂,螺丝松动脱落"
2137,动臂缸大小腔软管,"液压油管漏油,客户反应油管漏油,更换软管后试车正常"
2138,上罩支架,"上罩支架断裂。,发动机机罩晃动大,发动机上罩支架断裂"
2139,油管接头,"挂挡手柄脱落,挂挡手柄脱落,装上挂挡手柄紧固螺丝，故障排除"
2140,左门锁,"左门锁打不开,驾驶室左门打不开,维修门锁后，门锁开关正常"
2141,左门锁,"门锁用钥匙锁不上,驾驶室左门锁损坏,锁芯损坏，更换新门锁后正常"
2142,组合阀,"整车无法行走,整车无法行走,质量问题"
2143,螺栓,"左门关不上。,该用户反应机器左门关不上。,左门门锁固定螺丝松动导致左门关不上。紧固螺丝后试机运转正常。"
2144,刹车管,"刹车油管漏油,油管漏油,漏油"
2145,O型圈,"液压管漏油,液压油散热器管路连接处漏油,管路O型圈失效"
2146,空调压缩机,"无空调,无空调,压缩机拉缸，皮带丢失"
2147,左门锁,"门锁开关故障,驾驶室门关不上,门锁卡滞，清洁调整位置后正常"
2148,空调压缩机,"空调不制冷,空调不制冷,空调压缩机损坏失效"
2149,空调压缩机,"空调不制冷,空调不制冷,压缩机不工作"
2150,风扇支架,"风扇支架断裂,风扇支架断裂,风扇支架断裂"
2151,手刹间隙,"挂档无反应,手刹不良,手刹间隙过大导致手刹不良，调整间隙后工作正常"
2152,螺栓,"挂档无反应,挂档无反应,档位抄作杆螺丝脱落导致挂不进档，现场紧固档位抄作杆后试机正常"
2153,气管接头,"车辆气压低，无法打死，车辆不能正常工作,用户报修车辆无法打气，走不了路,组合阀接头松动导致漏气"
2154,螺栓,"前传动轴脱落，铲斗磨损不一致,手刹脱落,螺丝断裂"
2155,放水阀,"发动机漏油,气瓶放水开关坏,漏气"
2156,油管接头,"流量放大阀漏油。,流量放大阀外接管路漏油,流量放大阀外接管路接头松动。"
2157,O型圈,"客户报修车辆漏液压油,客户报修车辆漏液压油,胶管密封圈损坏"
2158,左门锁,"驾驶室门，关不上,驾驶室门，锁不上，关不上,门锁卡死，现场维修涂抹润滑脂"
2159,O型圈,"漏油,漏油,换上新的0型圈后工作正常"
2160,上罩支架,"顶盖支架断裂，消音器支架螺丝断裂,顶盖支架断裂,顶盖支架质量问题"
2161,刹车管,"后右刹车管挤扁，用户要求换刹车管,刹车油管挤变形,油管挤变形，用户要求更换"
2162,手刹间隙,"手刹不灵，送空调滤芯,手刹不灵，空调滤芯脏，送空调滤芯。,手刹间隙过大导致手刹不灵"
2163,喇叭,"喇叭不响更换喇叭,喇叭不响,喇叭不响"
2164,倒车报警器,"倒车报警器不响,倒车报警器不响。,倒车报警器损坏"
2165,刹车管,"刹车漏油抱刹,刹车漏油抱刹,刹车管路损坏"
2166,油管接头,"发动机漏油,油泵进油管组合垫漏油及高压油管接头松动,漏柴油"
2167,螺栓,"客户反应机器漏油,客户反应变速箱加油管漏油,螺丝松动"
2168,GPS,"GPS异常,GPS故障,GPS故障导致信息不同步 经过跟换后恢复正常"
2169,螺栓,"变速箱漏油,该机变速箱漏油,该机变速箱漏油，经现场检查是变速操作阀上堵头螺栓密封不严漏变速箱油"
2170,气制动阀总成,"脚制动阀漏气,制动阀漏气,密封不行"
2171,按钮阀,"偶尔漏气严重，挂挡间隙大，有时候挂不上档,踩刹车偶尔漏气,按钮阀漏气"
2172,GPS,"GPS计时不准确（更换）,GPS记时失效,损坏"
2173,动臂缸大小腔软管,"动臂油管漏油,动臂油缸连接软管漏油,软管漏油"
2174,工作泵,"变速箱油会增多,串油,经维修发现齿轮泵串油，内部密封圈损坏无法修复换上该件后试机正常运行"
2175,下铰接螺栓,"漏油|漏油,下交接螺丝断裂,螺丝松动，断裂"
2176,压缩机皮带,"空调压缩机异响。,用户报修机子异响,压缩机皮带松松动打滑造成异响。"
2177,加力器,"轮边漏油，加力器漏油,后加力器漏油,扣加力器漏油，"
2178,继电器,"整车无法启动,整车无法启动,继电气接触不良   更换继电器"
2179,加力器,"刹车不灵    加力器益油,刹车不灵,加力器内泄损坏"
2180,气制动阀总成,"刹车不灵    加力器益油,气压不够,制动阀损坏"
2181,油管接头,"机子漏油,该机驾驶室下边漏油,经检查该机驾驶室下边漏油是控制阀前端管路接头松动导致机子漏液压油"
2182,油管接头,"挂档手柄松动,操纵手柄晃动，无法正常工作,螺栓脱落"
2183,空调压缩机,"开空调压缩机不工作,开空调压缩机卡着不转,损坏，卡死"
2184,起动机,"发动机无法启动,发动机无法启动,起动机不工作"
2185,前传动轴及支承总成,"传动轴异响,异响,异响"
2186,工作灯,"桥漏油，全车灯不亮,顶灯损坏,检查更换"
2187,风扇,"风扇叶损坏断裂,风扇叶损坏,风扇叶损坏"
2188,风扇,"风扇叶损坏,风扇叶损坏,风扇叶扇叶松动损坏"
2189,油管接头,"漏油,客户反应漏油,重新调整紧固后试车正常"
2190,螺栓,"漏油,漏油。,经到现场检查发现流量放大阀管路螺丝松动导致漏油，经维修后试车工作正常"
2191,O型圈,"漏油,经到现场检查发现转向管漏油，松动,漏油"
2192,前桥螺栓,"前传动轴过桥轴承支架螺丝丢失松动,前传动轴中间过桥轴承固定支撑支架螺丝断裂,螺丝松动，经过行走抖动过大，过程中导致螺丝断裂"
2193,螺栓,"变速箱漏油,变速箱外部漏油,变速箱漏油"
2194,换档软轴,"行驶中一档脱档,一档工作时自动跳档,调整不当"
2195,螺栓,"变速箱漏油,工作泵漏油,螺母松动漏油"
2196,按钮阀,"按钮阀坏了，沒有前后挡位,手刹放下，按钮阀不通气压，没有前后挡位,按钮阀损坏，失效，不通气压"
2197,刹车管,"刹车不好用,刹车不好用,刹车钢管损坏"
2198,螺栓,"漏油,客户反应漏油,重新更换后试车正常"
2199,空调压缩机,"空调压缩机卡死,压缩机卡死,压缩机卡死不工作"
2200,推拉软轴,"动臂提升慢,客户反应举升慢,调整软轴后试车正常，维修完毕"
2201,按钮阀,"不行走。,失效,失效，漏气"
2202,左门锁,"门锁打不开,门锁锁不上,门锁锁芯损坏，造成钥匙锁不上门，更换门锁后正常"
2203,工作灯,"前大灯不亮,驾驶室前顶灯2个烧坏不亮,损坏，失效，进水"
2204,加力器,"装载机无刹车,用户反应前刹温度高，加力器反油,温度高，反油刹车不好"
2205,螺栓,"更换隔热板,隔热板固定支脚断裂。,固定螺栓松动导致断裂。"
2206,下铰接螺栓,"铰接销螺丝断裂,服务人员现场检查，该机下铰接螺丝全部断裂,服务人员现场检查，该机下铰接螺丝全部断裂，造成铰接销松动退到顶部磨到传动轴，经服务人员拆下该机低盖，并取出断裂螺丝，并装上新螺丝后，故障排除，试机工作正常"
2207,加力器,"无刹车,无刹车,加力器油杯松动导致漏油无刹车"
2208,螺栓,"漏柴油，,发动机油嘴处渗油,喷油嘴处渗油"
2209,O型圈,"漏油,客户报修漏液压油,更换O型圈后试车正"
2210,GPS,"GPS不上线,卫星定位跟踪器不上线,更换GPS后试车正常"
2211,O型圈,"漏油,客户反应漏油,经检查管接头漏油出来"
2212,气管接头,"漏汽,该机漏气、是因组合阀接头处、组合垫损坏所致。,拆检组合阀接头更换组合垫后、试机正正常。"
2213,O型圈,"漏油,经现场检查，发现流量放大阀至转向油缸油管漏油,O形圈损坏"
2214,前传动轴及支承总成,"传动轴及支承总成损坏,传动轴异响,传动轴损坏"
2215,气管接头,"漏气,漏气,固定紧螺母后试车正常"
2216,螺栓,"漏气,漏气,紧固螺母后试车正常。"
2217,手刹间隙,"漏油。,无手刹。,调整手刹盘间隙。"
2218,加力器,"加力器漏油,加力器加油口往出漏油,加力器里面的密封件损坏导致"
2219,气管接头,"漏气,漏气,加上组合垫工作正常"
2220,换档软轴,"挡位不好用,挡位不好用,调整软轴间隔后工作正常"
2221,雨刮总成,"雨刮臂不工作,客户报修雨刮臂不工作,紧固雨刮臂固定螺栓后试车正常"
2222,压缩机皮带,"异响,客户反应机子启动开空调，空调凉度不够，伴有异响。,压缩机皮带打滑导致异响。"
2223,组合阀,"漏气,客户反映机子漏气。,损坏"
2224,O型圈,"漏油,漏油,o圈损坏"
2225,液位计,"液位计漏油,液位计漏油。,液位计内油封坏"
2226,螺栓,"齿轮泵漏油,主齿轮泵漏油,螺栓松动"
2227,GPS,"GPS不好,GPS损坏,GOS内部故障"
2228,GPS,"更换GPS,GPS无数据,GPS终端损坏"
2229,燃油箱,"柴油箱漏油,柴油箱漏油,渗油"
2230,左门锁,"驾驶楼门锁不住,驾驶楼门锁不上,门锁扣断裂，拆下来重新焊接。安装可以锁门"
2231,加力器,"前加器喷刹车油,前加力器喷刹车油,前加力器喷刹车油"
2232,油管接头,"漏油,客户反应漏油,重新调整紧固后试车正常"
2233,推拉软轴,"大臂举升缓慢,客户反应大臂举升缓慢,重新调整紧固后试车正常"
2234,换档软轴,"一档脱档,一档脱挡,拉线调整有问题"
2235,刹车管,"刹车管漏油,刹车管漏油,更换刹车管"
2236,风扇,"风扇损坏,风扇损坏,更换新风扇之后试车正常"
2237,继电器,"先导手抦卡不住。,用户反应该机起大臂时，手柄卡不住,经装配新继电器后试机，该机动臂举升手柄卡不住现象消失，故障排除"
2238,风扇支架,"发动机卡死不会转,风扇皮带断裂，风扇支架卡死,发动机风扇支架内部损坏导致发动机卡死。"
2239,继电器,"整车线路被烧,启动继电器烧毁，车辆无法正常运转,继电器被烧毁，车辆无法正常运转"
2240,工作泵,"该车辆动臂起升慢,该车辆动臂起升慢,工作泵内泄"
2241,气管接头,"驾驶室底下漏气,驾驶室底下漏气,脚踩阀管漏气"
2242,动臂缸大小腔软管,"动臂油管漏油,右动臂油管漏油,油管啤接口松动所至漏油"
2243,O型圈,"工作泵漏油,工作泵接头漏油，测压口漏油,O硬化，损坏"
2244,冷媒,"空调不制冷,空调不制冷,更换新的o形圈加入新的制冷剂后故障排除"
2245,O型圈,"漏油,客户报修漏油,更换O型圈后试车正常"
2246,放水阀,"气压打不满,气压打不满,储气罐放水阀调整"
2247,O型圈,"漏液压油,客户报，漏液压油，无大小臂提升,主液压泵出油接头处，堵头o型圈损坏。"
2248,加力器,"后轮刹车抱死,刹车抱死,更换加力器，工作正常"
2249,工作灯,"前大灯不亮,驾驶室大灯不亮,更换驾驶室新大灯后试车正常"
2250,推拉软轴,"操作杆重,操纵杆重,调整位置偏差"
2251,油管接头,"漏油,漏油,转向泵出油管之优先阀接口处漏油   管口松动导致漏油  重新上紧后回复正常使用"
2252,气管接头,"漏气,加力器管头松动,加力器管头松动导致漏气"
2253,雨刮总成,"雨刮器保险插不住，一开雨刮器就烧保险,搬动开关雨刮器不工作,雨刮电机损坏"
2254,螺栓,"传动轴螺栓松动,用户打黄油时发现传动轴螺栓松动,传动轴螺栓松动"
2255,气管接头,"机子不行走,该机机子不行走,该机机子不行走，经检查是空气压缩机到气组合阀进气管路，接组合阀一端接头松动，气无法进储气罐，从而导致气压不够，整机不行走"
2256,动臂缸大小腔软管,"管子漏油,经现场检查，左侧动臂油缸—分配阀软管渗油,漏油"
2257,手刹间隙,"不行走。,机器无力。,手刹间隙小。"
2258,螺栓,"前轮漏油,斗放平指示杆歪,拧紧固定螺丝"
2259,螺栓,"油管漏油,油管漏油,松动"
2260,工作灯,"前后大灯坏了,顶灯不亮,灯大灯损坏"
2261,前传动轴及支承总成,"传动轴损坏,前传动轴，支撑损坏,前传动轴支撑报坏"
2262,喇叭,"喇叭一直自动响。后灯不亮,后工作灯不亮,灯泡烧坏"
2263,工作泵,"工作泵损坏,压力达不到,内部损坏"
2264,换档软轴,"跳档,换档档位跳动,挂档拉线松动"
2265,O型圈,"漏油,客户反应漏油,重新更换密封圈后试车正常"
2266,推拉软轴,"推拉软轴沉重,客户反应推拉软轴沉重,重新更换推拉软轴后试车正常"
2267,喇叭,"喇叭不响,电味喇叭不叫,喇叭坏了"
2268,压缩机皮带,"空调皮带一直断裂,空调压缩机皮带损坏,更换皮带后使用正常"
2269,刹车管,"前桥刹车管破裂漏油。,前桥左右两端刹车管破裂漏油。,破裂"
2270,加力器,"刹车不灵,刹车不灵,加力器漏油"
2271,O型圈,"漏油,客户报修漏油,更换O型圈后试车正常"
2272,螺栓,"漏气,漏气,紧固软管固定螺栓后试车正常"
2273,O型圈,"漏油,漏油,更换o型圈后试车正常"
2274,雨刮总成,"雨刮器不喷水,客户报修雨刮臂不喷水,安装固定软管后试车正常"
2275,O型圈,"转向油缸漏油,客户反映转向油缸漏油,密封圈损坏导致漏油"
2276,工作泵,"动臂起的慢,动臂起的慢,判断工作泵损坏，工作泵内漏，更换工作泵"
2277,雨刮总成,"雨刮器损坏,雨刮器损坏,雨刮器损坏"
2278,螺栓,"前桥主传动位置会漏油，,前主传动漏油，,正常损坏"
2279,刹车管,"刹车不良,刹车不良,油管被石头撞裂导致没刹车  经过更换刹车管和排空后恢复正常"
2280,换档软轴,"托挡,托挡,调整好后工作正常"
2281,气管接头,"漏油,客户反应漏油,重新紧固后试车正常"
2282,刹车管,"刹车不好用,客户反应刹车不好用,重新更换钢管后试车正常"
2283,O型圈,"装载机前车架漏油。,装载机流量放大阀管路漏油。,O型圈损坏。"
2284,压缩机皮带,"无空调,无空调,皮带过松"
2285,油门踏板,"加不起油,用户反应该机加不起油,拆下后更换新件故障排除"
2286,O型圈,"流量放大阀漏液压油,流量放大阀阀体漏油,密封圈损坏"
2287,O型圈,"漏油,转斗油缸大腔钢管与软管接口处漏油,质量问题"
2288,螺栓,"消声器支架螺丝断裂,消声器支架螺丝断裂,螺丝断裂"
2289,燃油箱,"柴油箱漏油,燃油箱漏油,经更换总成后 试机正常"
2290,GPS,"GPS定位不准确（更换）,GPS定位不正确,现场更换GPS，后试机正常"
2291,手刹间隙,"雨刮不归位，手刹放不到底,雨刮器往右打死，不归位，手刹拉线松,玻璃面太小，雨刮触边角，不归位，手刹拉线间隙大"
2292,刹车管,"刹车管损坏,刹车油管断裂,质量问题"
2293,工作灯,"前工作灯不亮；客户反映新车回来20个小时，前大灯不亮,大灯不亮,大灯损坏"
2294,放水阀,"不能行走,不能行走,扭紧放水开关螺丝"
2295,O型圈,"漏油,漏油,转向油缸管路O型圈损坏导致漏油"
2296,左门锁,"门锁关不上，打不开,门关不上。,埙坏"
2297,刹车管,"刹车管损坏；胶管漏油,刹车钢管损坏，,损坏"
2298,动臂缸大小腔软管,"左动臂油缸大腔液压油管漏油。,用户反应大臂油管软管漏液压油,经拆卸左大臂小腔软管更换新软管重新装配后试机，该机漏液压油现象消失，故障排除"
2299,GPS,"GPS故障，不上线，,GPS定位失效，不上线,GPS不定位，终端不在线，失效"
2300,螺栓,"门锁不好,门锁不好用,把松动的螺丝外理好工作正常"
2301,螺栓,"漏气；电机指导,漏气,换上新的组合垫后，I作正常"
2302,雨刮总成,"雨刮不工作、爆保险,雨刮不工作、爆保险,地线打铁"
2303,O型圈,"漏油,该机转斗油缸进油管接头处漏油！,经现场拆下拆机的转斗油缸进油软管发现考油缸一侧O型圈损坏，故该机转斗油缸进油管接头处漏油是因为内部O型圈损坏密封不严所致！"
2304,冷媒,"空调不凉,空调不凉,空调制冷剂不够   加够后恢复正常"
2305,O型圈,"漏油,油管漏油,更换0形圈"
2306,压缩机皮带,"有异响,空调皮带松动,空调皮带，松动"
2307,压缩机皮带,"异响,机子有异响,磨损"
2308,加力器,"无刹车,损坏失效,经现场检发现加力器损坏失效，更换新件试车后正常工作"
2309,螺栓,"铲斗开裂,摇臂销退出,摇臂销固定螺丝座脱悍"
2310,工作泵,"装载机工作泵漏油,工作泵,,工作泵"
2311,油管接头,"漏油,油箱到工作泵管路漏油,现场检查该机液压油箱到工作泵的管路管接头处漏油，服务人员检查该机的管接头有松动，经服务人员维修紧固后，故障排除，试机工作正常"
2312,工作泵,"举臂无力,测量工作泵压力发现压力偏低工作泵异响，更换新件，故障解除,工作泵压力偏低，工作泵异响"
2313,倒车报警器,"倒车喇叭不响,倒车喇叭不响,更新的倒车喇叭，再试，故障排除"
2314,油管接头,"变速箱漏油,变速箱油低吸油箱管接头丝口损坏，导致漏油,重新连接管节口后正常"
2315,组合阀,"不排气,不排气,密封件磨损"
2316,螺栓,"客户反应车子漏油,客户反应车子漏油正常排查过程车子漏气螺丝松动,正常磨损"
2317,继电器,"客户反映起动不了，马达不转,起动不了,继电思松动"
2318,O型圈,"漏油,工作泵出油法兰测压堵头漏油,测压堵头O型圈损坏，更换O型圈，故障排除"
2319,燃油箱,"加不起油,加不起油,柴油格，柴油箱脏"
2320,组合阀,"气压过高|气压过高,气压过高,组合阀存在故障"
2321,O型圈,"分配器漏油,流量放大阀外部漏油,O型圈损坏造成漏油"
2322,螺栓,"轮毂漏油,客户反馈轮边漏油。,现场检查发现轮胎螺丝松动及断裂导致结合面漏油。拆下轮胎后。更换前右轮胎螺丝12只。安装轮胎后。试车正常。"
2323,油管接头,"客户反应机子发动不着,车子发动不着,松动"
2324,O型圈,"装载机漏油,O型圈损坏,O型圈损坏"
2325,推拉软轴,"不行走。,跳档,操纵软轴锁紧螺毌松动导致跳档"
2326,左门锁,"左门锁损坏,左门锁从外面打不开,门锁扣生锈"
2327,气管接头,"前桥刹车漏油，刹车疲软,刹车漏油，刹车疲软,管子有裂缝"
2328,雨刮总成,"雨刮不工作,雨刮不工作,更换雨刮电机"
2329,放水阀,"气压打不上，车辆无法行走,铲车不走,排水阀松动"
2330,起动机,"发动机无法启动,发动机无法启动,起动机不工作"
2331,推拉软轴,"无前进挡,无前进挡,间隙过大"
2332,O型圈,"漏油,漏油,更换新O 型圈后试车正常"
2333,组合阀,"机车报警无法行走,机车报警无法行走,检查为组合阀漏气导致气压低报警无法行走，更换组合阀后故障排除"
2334,左门锁,"门锁打不开,门锁打不开,门锁的锁心发卡造成打不开门。锁心加油润滑后可以正常使用"
2335,放水阀,"储气罐，漏气,储气罐放水阀漏气,储气罐放水损坏，造成漏气，更换新的放水阀，故障排除"
2336,O型圈,"漏气,用户反应流量放大阀有渗油,流量放大阀进油管密封件损坏，导致漏油"
2337,组合阀,"车不上气,车不上气,组合阀漏气"
2338,液位计,"变速箱漏油,变速箱液位计漏油,变速箱液位计损坏失效漏油"
2339,螺栓,"变速箱渗油,透气盖有点渗油,螺栓紧固"
2340,压缩机皮带,"发动机异响,发动机吱吱异响,空调皮带和风扇皮带过松"
2341,左门锁,"发动机异响,驾驶室异响,检查驾驶室门锁磨损，门锁卡扣固定处开裂"
2342,GPS,"整机GPS故障，数据不更新！,检查装机GPS数据不更新，不反馈数据！,更换新的GOS正常！"
2343,O型圈,"液压油管漏油,液压油箱回油钢管漏油,液压油箱回油钢管与分流阀连接处O型圈丢失，只剩下一小段，导致漏油"
2344,O型圈,"散热器漏油,液压油到散热器接头漏油。,密封圈损坏，更换密封圈。"
2345,O型圈,"漏液压油,工作泵出油管堵头漏油,堵头O型圈断裂"
