,static,sentence
6891,气制动阀总成,"跳档，刹车不好,用户反应该机刹车不好,经服务人员现场检查，该机刹车不灵，服务人员近一步检查，该机在使用过程中，踩下刹车踏板时该机制动阀有漏气现象，造成该机有时候刹车不太灵，经服务人员跟换该机制动阀后，故障排除，试机工作正常"
6892,空调继电器,"空调不凉,空调不凉,空调继电器损坏"
6893,下铰接螺栓,"铰接销螺丝脱落,铰接销螺丝断落,螺丝断落"
6894,加力器,"用户来电报修：机子换挡有时不会走，加力器漏油,机子加力器漏油,检查发现机子加力器漏油导致刹车不灵"
6895,按钮阀,"用户来电报修：机子换挡有时不会走，加力器漏油,机子挂挡有时不会行走,检查发现按钮阀损坏导致机子挂挡有时不会行走"
6896,按钮阀,"按纽阀漏气，,按钮阀损坏，,内部漏气"
6897,左门锁,"门锁，制动踏板过低,锁不了门,锁不了门"
6898,螺栓,"无法行走,调整变速操纵拉线螺母,变速操纵拉线螺母松动"
6899,冷媒,"空调不制冷,空调不制冷,冷媒过多"
6900,螺栓,"漏油,传动轴有响声,传动轴螺丝松动。"
6901,加力器,"刹车损坏,刹车不好,加力器刹车效果不好"
6902,冷媒,"空调不制冷,用户来电反应空调不制冷,缺冷媒"
6903,按钮阀,"挂上挡，不行走。,机器不会走,按钮阀损坏，导致切断阀打不开，机器不会走"
6904,前桥螺栓,"前桥螺栓断裂。,前桥螺栓断裂,螺栓断裂"
6905,加力器,"刹车不行,刹车不灵,刹车不灵"
6906,左门锁,"门关不了,门关不了,门锁软轴太长"
6907,风扇,"更换皮带，风扇叶,更换皮带，风扇,皮带和风扇段烈导致机器无法工作，现场给予客户更换皮带,和风扇。"
6908,工作泵,"大、小臂无力，抬不起来。,大臂抬不起来,多个故障重合"
6909,空调压缩机,"空调压缩机损坏导致无空调,空调不制冷,空调压缩机损坏导致空调不制冷"
6910,左门锁,"门锁故障,门难开,门锁机构松动"
6911,空调继电器,"空调散热网一直转,风机一直转,更换继电器后故障排除"
6912,油门踏板,"油门加速不起,发动机功率不足,检查电路，清理踏板"
6913,加力器,"刹车喷油,刹车加力气往外喷油,经维修人员现场维修及更换新加力器后试机整机工作正常"
6914,上罩,"后机罩开裂,发动机罩盖开裂,发动机罩盖开裂"
6915,螺栓,"发动机右犄角螺栓和螺母脱落,发动机右犄角螺栓螺母脱落,发动机右犄角螺栓螺母脱落"
6916,组合阀,"机车漏气,机车漏气,检查为组织阀内部出现故障导致漏气，更换组合阀后故障排除"
6917,放水阀,"机车漏气,机车漏气,检查为手动放水阀密封不好导致漏气，更换手动放水阀后故障排除"
6918,螺栓,"变速箱漏油,变速箱漏油,变速箱观油镜固定螺丝松动"
6919,加力器,"刹车不灵,刹车不灵，制动距离远。,加力器制动力不足"
6920,气制动阀总成,"制动阀漏气,制动阀漏气,制动阀漏气"
6921,油管接头,"发动机漏柴油,客户来电反映装载机发动机漏柴油,高压油管接头处磨损有间隙导致漏柴油，重新添加垫片后安装一切正常！"
6922,螺栓,"清洗柴油油路,转斗缸高压油管固定U型螺丝脱落，松动,螺丝松动引起脱落"
6923,螺栓,"前桥异响,用户反应前桥有异响。,传动轴法兰螺母松动。"
6924,空调压缩机,"空调不制冷,空调不制冷,压缩机损坏"
6925,空调继电器,"空调不制冷,空调不制冷,更换继电器"
6926,下铰接螺栓,"司机反应下铰接销有间隙  下面固定螺栓丢失,下铰接销上移 下部固定螺栓丢失,螺栓强度偏低"
6927,螺栓,"车没刹车，转向抖料有响声,齿轮泵处螺丝松动，造成转弯憋压时会有异响。现场检查齿轮泵漏油。,泵处螺丝松动，带有漏油。"
6928,雨刮总成,"雨刮电机有时不动,雨刮电机一档有时不动,雨刮电机内部线路故障"
6929,组合阀,"气压低，,打气慢，踩刹车三次气压低报警。,组合阀漏气"
6930,空调压缩机,"空调没风,压缩机内部算坏,压缩机损坏导致管路及储液罐及蒸发箱损坏"
6931,加力器,"刹车不好,刹车不好,加力器压力不够"
6932,加力器,"刹车不好,前加力器加油口冒油,密封件损坏"
6933,螺栓,"轮边漏油,轮边漏油,轮辋螺丝脱落"
6934,加力器,"前加力器喷油。,刹车不灵，刹车油从加力器加油盖子处喷出来,前加力器损坏"
6935,燃油箱,"漏柴油,漏油,开裂"
6936,组合阀,"漏气,漏气,组合阀漏气故障导致刹车系统失常。"
6937,螺栓,"漏液压油,漏液压油,工作泵出油管法兰螺丝断裂，导致出油管O型圈损坏"
6938,加力器,"刹车踩不住,刹车踩不住,经到现场检查发现前加力器损坏"
6939,空调压缩机,"压缩机不工作,空调不凉,轴承松动导致"
6940,O型圈,"漏油,该机转向油缸漏油、是因O形圈埙坏所致。,外部漏油。"
6941,空调压缩机,"空调不凉,空调不凉,空调压缩机内部故障导致空调不制冷"
6942,螺栓,"报故障码，加不起油，刹车不好,柴油箱漏油,螺丝松"
6943,加力器,"加力器踩起发响刹车不好,有时候发响,埙坏"
6944,螺栓,"动臂起升慢,用户反映动臂启动慢,调整软轴，正常使用"
6945,加力器,"刹车不好,刹车不好,磨损漏油"
6946,加力器,"漏气,刹车不好加力器漏气,损坏"
6947,螺栓,"变速箱漏油,变速箱漏油,输出法兰螺栓断裂"
6948,空调压缩机,"空调不制冷,客户反应空调不制冷,根据现场试车检查初步判断为压缩机故障，现暂无配件，需订货。"
6949,螺栓,"先导阀有异响,起臂收斗有异响,螺丝松动"
6950,油门踏板,"有时加不上油,有时加不上油门,油门踏板插接触不良"
6951,加力器,"后加力器漏油，刹车不好,后加力器漏油，漏气导致刹车不好,更换加力器，添加刹车油，排除刹车空气"
6952,螺栓,"漏气,用户反应该机前桥加力器漏气,经现场检查发现该机前桥加力器螺丝松动造成漏气，拧紧螺丝，故障排除，整机运行正常"
6953,螺栓,"漏气,客户反应该机加力器漏气,经服务人员现场检查发现该机加力器螺丝松动造成漏气，拧紧螺丝，故障排除，整机运行正常。"
6954,雨刮总成,"雨刮电机损坏,雨刮电机冒烟,雨刮电机烧坏"
6955,左门锁,"左门锁损坏打不,左门 门锁打不开,拆检左门调整门锁拉线后试车正常"
6956,工作泵,"起不了臂，工作泵有异响,起不了大臂，有异响,工作泵损坏。"
6957,油管接头,"油管漏油,漏油,接头破损"
6958,刹车管,"刹车漏油,刹车油管漏油,刹车油管破裂导致漏油"
6959,气制动阀总成,"前后轮刹车拖剎,前后轮刹车拖刹,气制动阀内部损坏导致前后轮刹车拖刹"
6960,空调压缩机,"无空调,无空调,压缩机拉缸"
6961,下铰接螺栓,"修交接,铰接下销固定螺栓断裂,铰接下销固定螺丝断裂"
6962,冷媒,"空调不制冷。,客户保修空调不制冷,添加冷媒后试机运行正常"
6963,组合阀,"停车熄火后，20分钟左右气压就会漏掉，气压漏气,整机熄火挺久了，造成气压不足,组合阀漏气"
6964,气制动阀总成,"漏气,漏气,制动阀密封不价"
6965,螺栓,"跳挡。,跳档,检查变速箱操作系统，发现挂档软轴固定螺栓松动 导致跳档"
6966,螺栓,"刹车漏气,踩刹车时有漏气现象。,踩刹车检查气管路发现制动阀至加力器管路螺母松动导致漏气。"
6967,下铰接螺栓,"交接下销螺丝断裂,下铰接销螺栓断裂。,下铰接销螺栓松动导致断裂。"
6968,前桥螺栓,"前桥固定螺栓断裂，喇叭不响。,前桥紧固螺栓断裂。,前桥紧固螺栓断裂。"
6969,工作泵,"举大臂没力,用户反映漏油，举不起大臂,工作泵内泄，主安全阀发卡"
6970,空调压缩机,"空调不制冷,空调不制冷,正常损坏"
6971,刹车管,"刹车漏油,刹车漏油,更换刹车管后使用正常"
6972,前传动轴及支承总成,"前传动轴晃动,前传动轴走动时候晃动,轴承座磨损"
6973,空调继电器,"空调开关开不了,空调没电,继电器烧了"
6974,螺栓,"空调不制冷 ,机子会发响,该机机子行走时后面发响,该机机子行走时后面发响，经检查是液压油箱固定螺栓松动所致，导致油箱晃动发响"
6975,下铰接螺栓,"漏油,铰接销螺丝断,铰接下销螺丝断。重新更换新的螺丝。"
6976,油管接头,"车辆变速箱漏油,客户反应变速箱加油口漏油,变速箱与加油口软管出现管头松动"
6977,油管接头,"驾驶室下方滴油,变速箱加油管接头漏油,漏油"
6978,加力器,"刹车不好使,刹车不好使,加力器漏气"
6979,风扇,"风扇损坏,风扇损坏,打怪"
6980,风扇,"发动机抖动,发动机抖动,风扇叶损坏"
6981,气管接头,"铲车不走,铲车无法行走,管路松动"
6982,加力器,"刹车不灵,客户反应，刹车不灵,加力器损坏"
6983,前传动轴及支承总成,"传动轴异响,传动轴异响,更换维修后试车工作正常。"
6984,左门锁,"左门锁锁不住,门锁锁不住,锈蚀"
6985,下铰接螺栓,"铰接下销螺丝断裂,下铰接螺丝断裂，下铰接销往上移动，顶到传动轴异响,铰接下销螺丝断裂"
6986,螺栓,"门架螺丝断裂,销子固定螺丝断裂,螺丝断裂"
6987,液位计,"该机无刹车，液位计漏油。,液位计漏油,液位计损坏"
6988,加力器,"该机无刹车，液位计漏油。,该机刹车无力,加力器损坏"
6989,液位计,"液压油箱，液位计漏油,液位计外部漏油,加固，调整垫片"
6990,左门锁,"左门打不开,左门打不开,门锁锁芯脱落"
6991,GPS,"GPS坏,GPS坏,GPS坏"
6992,空调压缩机,"空调不凉,空调不凉,清理管路，更换压缩机后正常"
6993,加力器,"漏油,油杯漏油,油杯油封huai?q"
6994,气制动阀总成,"无刹车,新来的铲车师付反映：无刹车,间隙偏差"
6995,螺栓,"客户反映车子变速箱漏油,客户来电反映车子波箱漏油,变速箱前输出法兰固定螺栓断裂"
6996,加力器,"漏油,该机在踩刹车时前加力器油杯透气孔内有制动液喷出！,经现场检查该机踩刹车时前加力器透气孔内有制动液喷出是因为加力器内部损坏密封不严串气所致！"
6997,气制动阀总成,"刹车不好,经现场检查，拆开前加力器进气管发现有漏气现象,损坏失效"
6998,螺栓,"漏油,漏油,把松动的螺丝固定好工作正常"
6999,油管接头,"漏油,漏油,先导油滤油管松动"
7000,液位计,"液压油箱漏油,漏油,密封不严"
7001,刹车管,"整机没刹车,整机没有刹车,刹车油管损坏。"
7002,气管接头,"漏气,漏气,紧固测压口螺栓后试车正常。"
7003,前传动轴及支承总成,"传动轴松动，有异响。,开车过程中有异响大。,支撑轴承座松动。"
7004,工作灯,"顶棚灯不亮,顶棚灯不亮,顶棚灯不亮"
7005,组合阀,"组合阀漏气,气压高报警，组合阀漏气。,组合阀漏气"
7006,油管接头,"漏油,漏油,密封圈损坏"
7007,空调压缩机,"空调不制冷,用户反映，空调不制冷,压缩机窜气。导致不制冷"
7008,上罩,"异响,发动机上罩通风板工作时异响,机罩上通风板固定丝少"
7009,组合阀,"漏气,气压低，打不到0.8兆帕,组合阀漏气"
7010,左门锁,"左门锁开不了,左门锁开不了,锁扣断裂"
7011,风扇,"风扇断裂,风扇断裂,风扇扇叶断裂导致发动机抖动"
7012,液位计,"液位计漏油,油位计漏油,油位计密封失效"
7013,加力器,"前轮加力器窜油,前轮刹车加力器漏油,刹车加力器损坏"
7014,风扇,"风扇叶损坏,司机反应风扇叶损坏,质量问题导致风扇损坏"
7015,螺栓,"车子挂档不走,车子挂档不走,按钮阀固定支架螺栓松动导致不能完全压到位"
7016,下铰接螺栓,"下铰接跑上来,下铰接螺丝断裂,螺丝断裂"
7017,气管接头,"漏气,用户反馈该机气制动阀总成漏气,维修拧紧气制动阀总成管子接头后，故障排除。"
7018,空调压缩机,"空调不凉,空调不凉,空调压缩机损坏"
7019,放水阀,"报故障码,打不足气压，仪表盘气压报警,放水阀保护块变形，导致漏气"
7020,油管接头,"液压管漏油,油管接头漏油,接头松动漏油造成无法工作"
7021,螺栓,"变速箱漏油,变速箱放油螺丝脱落,变速箱放油螺丝脱落    "
7022,螺栓,"收斗不好用,客户反应收斗不好用,重新调整紧固后试车正常"
7023,螺栓,"变速箱无二挡,客户反应该车无二档,重新紧固并调整后试车正常"
7024,螺栓,"前桥异响异响,前桥异响,前桥异响,"
7025,螺栓,"前传动轴螺丝断裂,前传动轴螺丝断裂,检查发现前传动轴枕式轴承座固定板螺丝断裂，取出螺丝，重新安装螺丝后故障排除。"
7026,空调压缩机,"空调不制冷,空调不制冷,压缩机拉缸"
7027,油管接头,"装载机漏油,装载机漏油,维修紧罗丝后一切正常"
7028,风扇支架,"发动机摆动大,风扇底座轴承损坏,风扇底座轴承损坏"
7029,风扇,"发动机摆动大,发动机摆动大,风扇支架轴承晃动造成风扇损坏"
7030,螺栓,"前桥螺丝断裂,前车架螺丝断裂。,前车架螺丝损坏失效。"
7031,油门踏板,"加不上油门,加不上油,更换该车油门当，试车正常。"
7032,气制动阀总成,"刹车不好,脚制动损坏,脚制动损坏。"
7033,空调压缩机,"空调不制冷,空调不制冷,空调压缩机拉缸"
7034,加力器,"前刹车不好,经现场检查，前刹车无制动！刹车盘无温度,损坏失效"
7035,螺栓,"车下有异响声,现场检查发现该机发动机机脚螺栓掉三颗！,该机发动机机脚螺栓掉是因为振动后松动脱落！"
7036,螺栓,"车下有异响声,现场检查该机空气滤芯支架固定螺栓脱落一颗，其他的固定螺栓也都有松动现象！,该机空气滤芯支架固定螺栓松动并有一颗掉落是因为振动造成的！"
7037,螺栓,"车下有异响声,现场检查该机车下有异响是因为前传动轴支撑托架固定螺栓松动后造成的！,现场检查该机车下有异响是因为前传动轴支撑托架固定螺栓松动后造成的！"
7038,螺栓,"发动机底座螺栓丢失，燃油表不准,发动机底座螺栓丢失,发动机底座螺栓断裂丢失"
7039,前桥螺栓,"前桥螺丝断掉,前桥固定螺栓断掉,检查前桥固定螺栓丢失2个，更换后恢复正常"
7040,油门踏板,"报警无法正常工作,报故障代码1239整机无法正常工作,油门踏板损坏，更换油门踏板之后整机恢复工作正常"
7041,空调继电器,"空调不制冷,空调不制冷,经检查，原因在于继电器损坏，现更换后，整机正常工作"
7042,空调压缩机,"空调不制冷。,空调不制冷。,经检查后，把空调压缩机及其他附件拆除更换新件处理，拆除安装紧固螺栓清洗管路天加冷气处理后，试机工作正常。"
7043,喇叭,"喇叭不响,喇叭不响,喇叭不响，更换"
7044,螺栓,"打不上气,打不上去,打紧管螺母故障解决"
7045,下铰接螺栓,"交接螺丝断裂,客户反应。铰接螺栓脱落,拆掉断裂螺丝后， 换新的罗螺栓后车子正常"
7046,左门锁,"更换门锁,左门打不开,门锁失效,,,"
7047,空调压缩机,"空调不制冷,空调不制冷。,空调压缩机损坏。"
7048,空调压缩机,"空调不制冷,空调不制冷。,空调压缩机内部损坏导致不制冷。"
7049,气管接头,"漏气,上气慢,漏气"
7050,螺栓,"漏油,漏油,紧固螺母后试车正常"
7051,O型圈,"漏油,客户反应漏油,动臂进油管O行圈冲了"
7052,气管接头,"漏气,漏气,紧固接头螺母后试车正常"
7053,冷媒,"空调不凉,压缩机压力异常,质量问题"
7054,空调压缩机,"压缩机故障,不制冷,压缩机质量问题"
7055,放水阀,"放水阀漏气,放水阀打不开,放水阀损坏导致"
7056,加力器,"前桥轮边抱刹，加力器返油。,前轮抱刹,加力器损坏"
7057,喇叭,"喇叭不响,喇叭不响,喇叭不响"
7058,O型圈,"漏油,漏油,原因在于转向泵测压接头O兴圈损坏，现更换后，整机正常工作"
7059,螺栓,"油管卡子掉了,油管卡子掉了,松动"
7060,空调压缩机,"空调不制冷,空调不制冷,更换压缩机故障排除"
7061,加力器,"刹车不好,加力器漏油。,内部泄漏"
7062,下铰接螺栓,"下铰接匡量大,铰接旷量大，下铰接螺栓断折，更换新骡栓,时间长未检查紧固，松动后断折"
7063,工作灯,"用户反应保险一直烧，不能作业，要求处理。,司机反应F18号前工作灯保险换不住，插上就烧，前工作灯不亮,右侧工作灯内部短路。保存时照片丢失，再次现场补照上传无反应，照片保存在手机相册里"
7064,O型圈,"漏油,经现场检查，转向器进油管接头处漏油,外部漏油"
7065,空调压缩机,"空调不制冷,空调不制冷,压缩机失效窜气导致空调不制冷"
7066,螺栓,"管接头漏油！,检查先导阀测压堵头螺丝松动漏油！,调整后正常！"
7067,螺栓,"变速箱漏油,变速箱前输出法兰处漏油,更换新的锁紧螺丝，重新加油，试车正常，故障排除"
7068,燃油箱,"柴油箱漏油,漏油,更换燃油箱后故障排除"
7069,加力器,"拖刹,客户反应后面拖刹,经检查加力器踩刹时，不回位，造成拖刹"
7070,油管接头,"变速箱漏油,变速箱壳漏油,回油接头松动漏油"
7071,左门锁,"左边门锁卡顿,门锁锁芯卡住,,门把手弹内簧脱落"
7072,GPS,"油耗显示忽多忽少。；智能管家显示油耗不准确。,智能管家油耗显示异常。,GPS定位跟踪器异常。"
7073,左门锁,"左门锁损坏,左门锁把手有卡顿，开门不易,门把手损坏"
7074,加力器,"刹车助力器喷油,加力器喷油,加力器内部损坏"
7075,刹车管,"刹车不灵,前轮无杀。,损坏。"
7076,GPS,"1，无二挡，2，前加力器漏油，3，GPS计时不准确。,GPS卫星定位跟踪器失效。,失效。"
7077,风扇支架,"用户报修该机风扇支架卡死、风扇皮带断裂,用户报修风扇支架卡死、风扇皮带断裂,风扇支架卡死、风扇皮带断裂"
7078,加力器,"1，前加力器漏油，2，变矩器油温传感器失效。,用户反应该机前轮没有刹车,经拆卸更换前轮加力器重新装配排除空气后试机，该机刹车灵敏，故障排除"
7079,风扇,"发动机震动,经现场检查，发动机震动大,断裂"
7080,下铰接螺栓,"铰接销间隙大,铰接螺栓断裂,铰接螺栓断裂"
7081,气管接头,"漏气,用户反馈该机气制动阀总成漏气,维修拧紧气制动阀总成管子接头后，故障排除，"
7082,空调压缩机,"空调压缩机不工作。,没有冷风,更换压缩机"
7083,油管接头,"油管漏油,油管漏油,松动"
7084,螺栓,"油箱螺丝松动,柴油箱螺丝松动。,柴油箱螺丝松动。"
7085,气管接头,"机子打气慢,该机刹车打气速度慢，气不够用,经现场检查该机气不够用，打气速度慢是因为储气筒进气管接头处密封不严漏气"
7086,螺栓,"发动机座子螺栓脱落,经现场检查，发动机机脚螺栓，盖脱落。,脱落"
7087,GPS,"GPS不准,该机GPS不准、不能定位。,GPS损坏所致。"
7088,气制动阀总成,"脚制阀漏气,脚制阀漏气,脚制阀漏气"
7089,空调压缩机,"空调不制冷，检查发现空调压缩机损坏,空调不制冷,压缩机离合器线圈损坏"
7090,加力器,"刹车不好用,刹车不灵敏 刹不住,加力器内部磨损损坏"
7091,GPS,"GPS损坏,GPS卫星定位跟踪器ABC灯常亮，工作小时数展示错误,损坏，失效"
7092,刹车管,"刹车漏油,左前轮后制动铅钢管断裂漏刹车油,断裂"
7093,加力器,"后轮无刹车,用户报修该车后桥无刹车,更换新件后正常使用"
7094,前传动轴及支承总成,"行走异响,行走异响,前传动轴损坏"
7095,油管接头,"漏油,转向漏油,重新维修紧固转向油管后试车正常"
7096,螺栓,"异响,装载机铲满料装车时有异响,后桥前摆动支架螺丝松动导致摆动支架晃动异响，紧固前摆动支架固定螺栓后故障解除"
7097,螺栓,"挂档不好使,操纵杆不好使,调整拉线紧固螺丝，正常使用"
7098,工作灯,"大灯不亮,大灯进水导致线路短路引起大灯不亮,重新连接线路及擦拭灯内水恢复正常"
7099,螺栓,"漏油,螺母松动造成外部漏油,紧固螺丝恢复正常"
7100,左门锁,"门锁坏,门锁坏,门锁坏"
7101,喇叭,"喇叭不响,喇叭不响,喇叭不响"
7102,液位计,"漏油,液位计漏油。,液位计损坏更换液位计。"
7103,空调继电器,"空调不凉,空调不凉,空调继电器损坏"
7104,O型圈,"漏油,油管接头漏油,O形圈损坏"
7105,冷媒,"空调不制冷,车子空调不制冷,雪种不够"
7106,左门锁,"门锁更换及后轿齿轮油更换,左门锁卡死,左门锁卡死"
7107,风扇支架,"风扇支架断裂,广康发动机系统故障,广康发动机系统故障"
7108,油管接头,"液压糸统漏油，,转向流量阀漏油，,经现场对该机软管接加固后试机工作正常，"
7109,空调压缩机,"空调不制冷,空调不制冷，压缩机不工作,压缩机不工作损坏"
7110,螺栓,"挡挂上手刹松开车不走,挂上挡，松开手刹车不走。,紧急制动阀座螺丝松动造成。"
7111,左门锁,"司机座椅调节不好使，车门打不开,室内打不开车门,断裂"
7112,O型圈,"漏油,漏油,油管接头O型圈损坏"
7113,空调压缩机,"空调不凉,压缩机损坏,压缩机损坏"
7114,风扇,"风扇损坏,风扇叶片损坏,风扇叶片裂"
7115,空调继电器,"空调不好用,无空调,继电器损坏"
7116,空调继电器,"空调不凉,空调不凉,空调继电器损坏"
7117,冷媒,"空调不制冷,空调不制冷，冷凝器断裂,空调冷煤过多，空调压缩机一会工作一会不工作"
7118,加力器,"无刹车,加力器漏气,内部损坏"
7119,螺栓,"大臂拉线紧,拉线偏紧。,螺丝松掉发卡。"
7120,前桥螺栓,"桥壳损坏,前桥桥壳固定座变形,前桥桥壳固定座变形"
7121,空调压缩机,"压缩机异响,压缩机异响,损坏"
7122,前传动轴及支承总成,"传动轴异响,前传动轴异响,轴承损坏"
7123,气制动阀总成,"漏气,漏气,紧急制动阀漏气"
7124,螺栓,"车老灭火,不好打车，经常熄火,紧固该车电瓶连接固定螺丝后，检查其它线路后试车正常"
7125,组合阀,"不上气压,不上气压,更换后，整机正常工作"
7126,加力器,"刹车抱死,前刹车抱死,更换加力器后，整机正常工作"
7127,冷媒,"空调不凉,空调不凉,空调压力低"
7128,左门锁,"门锁锁不上,锁不上门,门锁松动，异位卡滞导致锁不上门"
7129,油门踏板,"加不上油门,加不上油门,幽门踏板损坏造成加不上油门"
7130,螺栓,"拉线有间隙,小臂拉线有间隙,拉线固定螺丝松动"
7131,风扇,"用户反应整机工作时发动机发抖,用户反应整机工作时发抖,分扇叶片断裂导致发动机抖动"
7132,工作泵,"大臂起升缓慢,动臂起升缓慢，无力,检查齿轮泵损坏，检测压力为5MPa，有异响，导致大臂无力。拆解驾驶室座椅，地板，更换新齿轮泵，检测压力为17MPa，压力正常，试机工作正常"
7133,压缩机皮带,"空调压缩机持续异响，,用户反应该机启动后打开空调，压缩机异响声大,经拆卸更换新空调皮带轮及皮带重新装配后试机，该机空调异响声消失，故障排除"
7134,气管接头,"气不够用,气压不足,管接头松动"
7135,螺栓,"发动机漏油,共轨管漏油,螺栓松动造成漏油"
7136,空调继电器,"空调不凉,空调不通电,空调继电器损坏"
7137,加力器,"刹车不灵,机子刹车不灵,更换新件故障解除"
7138,螺栓,"整机异响,整车有异响,液压油箱螺丝松动"
7139,空调压缩机,"压缩机异响,压缩机异响,压缩机故障"
7140,O型圈,"漏油,漏油,动臂钢管o型圈损坏"
7141,螺栓,"车不会走,车不会走,紧急制动按扭阀限位螺栓脱落"
7142,加力器,"后加力气漏油,用户反应后加力器漏油,加力器喷油，外部漏油，更换加力器，试机正常"
7143,空调压缩机,"空调不制冷,空调不制冷,损坏压缩机不会转"
7144,组合阀,"没有刹车,没有汽压,组合阀损坏"
7145,空调继电器,"空调不工作,整机空调不工作,继电器损坏"
7146,O型圈,"车子发动机异响，空调不制冷,漏气,O型圈损坏漏气"
7147,O型圈,"侧卸油缸漏油！,侧卸油缸管路漏油,更换O型圈后正常"
7148,加力器,"前轮没有刹车！,现场查看发现踩刹车加力器油杯的油不下降,更换加力器后试车正常"
7149,冷媒,"空调不制冷,机子空调不凉，,损坏"
7150,螺栓,"异响,异响,散热器固定螺丝松动"
7151,气管接头,"刹车不灵,接头漏气，,接头松动。"
7152,按钮阀,"气压不够,手刹按钮阀，内部漏气。切断阀内部O型圈坏。,跟换按钮阀，维修切断阀O型圈。"
7153,螺栓,"用户反应变速箱处漏油,用户反应车辆变速箱漏油,螺栓松动所致"
7154,左门锁,"右门窗定位锁损坏,左门固定扣松动,松动"
7155,油管接头,"漏油,漏油,管路接头松动导致漏油"
7156,油门踏板,"加不起油门,客户电话报修，机子做工有时候踩油门踏板，发动机没反应。,油门踏接触不良"
